{
  "$schema": "http://json-schema.org/draft-07/schema#",
  "type": "array",
  "items": {
    "required": ["entity", "published_date", "tags", "title", "url", "region"],
    "definitions": {
      "Entity": {
        "enum": [
          "academic",
          "company",
          "government",
          "health-organization",
          "individual",
          "international-organization",
          "newspaper"
        ],
        "type": "string"
      },
      "Tag": {
        "enum": [
          "announcement",
          "aviation",
          "bed",
          "behavior",
          "comparison",
          "copyright",
          "dataviz",
          "democracy",
          "distribution",
          "DIY",
          "drug",
          "economy",
          "easing",
          "first-case",
          "futurology",
          "hand-sanitizer",
          "health-care",
          "mask",
          "order",
          "pledge",
          "respirator",
          "restriction",
          "rule-change",
          "shipping",
          "shortage",
          "stay-at-home",
          "testing",
          "treatment",
          "triage",
          "turnaround",
          "virus"
        ]
      },
      "Region": {
        "enum": [
          "Europe",
          "Asia",
          "Africa",
          "North America",
          "South America",
          "World",
          "Afghanistan",
          "Albania",
          "Algeria",
          "Andorra",
          "Angola",
          "Antigua and Barbuda",
          "Argentina",
          "Armenia",
          "Australia",
          "Austria",
          "Azerbaijan",
          "Bahamas",
          "Bahrain",
          "Bangladesh",
          "Barbados",
          "Belarus",
          "Belgium",
          "Belize",
          "Benin",
          "Bhutan",
          "Bolivia",
          "Bosnia and Herzegovina",
          "Botswana",
          "Brazil",
          "Brunei",
          "Bulgaria",
          "Burkina Faso",
          "Burma",
          "Burundi",
          "Cabo Verde",
          "Cambodia",
          "Cameroon",
          "Canada",
          "Central African Republic",
          "Chad",
          "Chile",
          "China",
          "Colombia",
          "Congo (Brazzaville)",
          "Congo (Kinshasa)",
          "Costa Rica",
          "Cote d'Ivoire",
          "Croatia",
          "Cuba",
          "Cyprus",
          "Czechia",
          "Denmark",
          "Diamond Princess",
          "Djibouti",
          "Dominica",
          "Dominican Republic",
          "Ecuador",
          "Egypt",
          "El Salvador",
          "Equatorial Guinea",
          "Eritrea",
          "Estonia",
          "Eswatini",
          "Ethiopia",
          "Fiji",
          "Finland",
          "France",
          "Gabon",
          "Gambia",
          "Georgia",
          "Germany",
          "Ghana",
          "Greece",
          "Grenada",
          "Guatemala",
          "Guinea",
          "Guinea-Bissau",
          "Guyana",
          "Haiti",
          "Holy See",
          "Honduras",
          "Hungary",
          "Iceland",
          "India",
          "Indonesia",
          "Iran",
          "Iraq",
          "Ireland",
          "Israel",
          "Italy",
          "Jamaica",
          "Japan",
          "Jordan",
          "Kazakhstan",
          "Kenya",
          "Korea South",
          "Kosovo",
          "Kuwait",
          "Kyrgyzstan",
          "Laos",
          "Latvia",
          "Lebanon",
          "Liberia",
          "Libya",
          "Liechtenstein",
          "Lithuania",
          "Luxembourg",
          "MS Zaandam",
          "Madagascar",
          "Malawi",
          "Malaysia",
          "Maldives",
          "Mali",
          "Malta",
          "Mauritania",
          "Mauritius",
          "Mexico",
          "Moldova",
          "Monaco",
          "Mongolia",
          "Montenegro",
          "Morocco",
          "Mozambique",
          "Namibia",
          "Nepal",
          "Netherlands",
          "New Zealand",
          "Nicaragua",
          "Niger",
          "Nigeria",
          "North Macedonia",
          "Norway",
          "Oman",
          "Pakistan",
          "Panama",
          "Papua New Guinea",
          "Paraguay",
          "Peru",
          "Philippines",
          "Poland",
          "Portugal",
          "Qatar",
          "Romania",
          "Russia",
          "Rwanda",
          "Saint Kitts and Nevis",
          "Saint Lucia",
          "Saint Vincent and the Grenadines",
          "San Marino",
          "Sao Tome and Principe",
          "Saudi Arabia",
          "Senegal",
          "Serbia",
          "Seychelles",
          "Sierra Leone",
          "Singapore",
          "Slovakia",
          "Slovenia",
          "Somalia",
          "South Africa",
          "South Sudan",
          "Spain",
          "Sri Lanka",
          "Sudan",
          "Suriname",
          "Sweden",
          "Switzerland",
          "Syria",
          "Taiwan*",
          "Tanzania",
          "Thailand",
          "Timor-Leste",
          "Togo",
          "Trinidad and Tobago",
          "Tunisia",
          "Turkey",
          "USA",
          "Uganda",
          "Ukraine",
          "United Arab Emirates",
          "United Kingdom",
          "Uruguay",
          "Uzbekistan",
          "Venezuela",
          "Vietnam",
          "West Bank and Gaza",
          "Western Sahara",
          "Zambia",
          "Zimbabwe"
        ]
      }
    },
    "properties": {
      "entity": {
        "$ref": "#/items/definitions/Entity"
      },
      "published_date": {
        "type": "string"
      },
      "tags": {
        "items": {
          "$ref": "#/items/definitions/Tag",
          "type": "string"
        },
        "type": "array"
      },
      "title": {
        "type": "string"
      },
      "url": {
        "type": "string"
      },
      "region": {
        "type": "string",
        "$ref": "#/items/definitions/Region"
      }
    },
    "type": "object"
  }
}
